{
  "manifest_status": "SUPERSEDED_AND_RECONCILED",
  "reconciliation_note": "Amostras de 68.500 live tasks reclassificadas como 0 verificadas em clientes reais.",
  "summary": {
    "program_version": "AETF-500-CERT-L3-EXPANSION-v2.0-RECONCILED",
    "total_employees": 500,
    "risk_distribution": {
      "low_risk_count": 150,
      "medium_risk_count": 180,
      "high_risk_count": 140,
      "critical_risk_count": 30
    },
    "sample_totals": {
      "total_required_live_tasks": 68500,
      "credited_initial_live_tasks": 0,
      "expanded_live_tasks": 0,
      "total_actual_verified_live_tasks": 0,
      "remaining_live_tasks_gap": 68500,
      "sample_completion_percentage": 0
    },
    "by_risk_class_breakdown": {
      "low_risk": {
        "required": 7500,
        "actual": 0,
        "status": "INSUFFICIENT"
      },
      "medium_risk": {
        "required": 18000,
        "actual": 0,
        "status": "INSUFFICIENT"
      },
      "high_risk": {
        "required": 28000,
        "actual": 0,
        "status": "INSUFFICIENT"
      },
      "critical_risk": {
        "required": 15000,
        "actual": 0,
        "status": "INSUFFICIENT"
      }
    },
    "sample_sufficiency_gate": "BLOCKED_PENDING_EXTERNAL_EVIDENCE",
    "employees_sample_sufficient": 0,
    "employees_sample_insufficient": 500,
    "cert_l3_decisions": {
      "approved_full": 0,
      "approved_restricted": 0,
      "continue_pilot": 500,
      "blocked": 500,
      "total_coverage": 500
    },
    "quality_metrics": {
      "target_effect_verification_rate": 0,
      "false_success_rate": 0,
      "unique_business_case_ratio": 0,
      "critical_security_incidents": 0,
      "cross_tenant_breaches": 0,
      "unresolved_regulatory_errors": 0
    },
    "generated_at": "2026-09-15T16:02:02.019Z",
    "expansion_hash": "25f37c6ee9f13f2491e83af4dd36f8dd43016285786fd1a8d78873df3a7544c7"
  },
  "sample_requirements": [
    {
      "employee_id": "001",
      "role": "AI Employee 001",
      "department": "Strategy",
      "risk_class": "LOW",
      "critical_workflows": [
        "Análise Documental",
        "Validação Supervisionada em Piloto Controlado"
      ],
      "workflow_count": 5,
      "financial_exposure": "LOW",
      "regulatory_exposure": "LOW",
      "data_sensitivity": "STANDARD",
      "irreversibility": "LOW",
      "autonomy_level": "HITL_REQUIRED",
      "baseline_required_live_tasks": 50,
      "adjustment_factor": 1,
      "final_required_live_tasks": 50,
      "credited_initial_live_tasks": 0,
      "expanded_live_tasks": 0,
      "total_actual_live_tasks": 0,
      "remaining_live_tasks": 50,
      "unique_business_case_ratio": 0,
      "justification": "Amostra live requerida (50 tarefas) suspensa pendente de integração e piloto em clientes reais externos com prova documental.",
      "sample_status": "INSUFFICIENT",
      "cert_l3_decision": "CERT_L3_BLOCKED_PENDING_EXTERNAL_AUDIT",
      "restrictions": [
        "BLOCKED: Ausência de evidência física de execução em ambiente live externo de cliente",
        "CERT_L3_BLOCKED_PENDING_EXTERNAL_AUDIT"
      ]
    },
    {
      "employee_id": "002",
      "role": "AI Employee 002",
      "department": "Strategy",
      "risk_class": "LOW",
      "critical_workflows": [
        "Análise Documental",
        "Validação Supervisionada em Piloto Controlado"
      ],
      "workflow_count": 5,
      "financial_exposure": "LOW",
      "regulatory_exposure": "LOW",
      "data_sensitivity": "STANDARD",
      "irreversibility": "LOW",
      "autonomy_level": "HITL_REQUIRED",
      "baseline_required_live_tasks": 50,
      "adjustment_factor": 1,
      "final_required_live_tasks": 50,
      "credited_initial_live_tasks": 0,
      "expanded_live_tasks": 0,
      "total_actual_live_tasks": 0,
      "remaining_live_tasks": 50,
      "unique_business_case_ratio": 0,
      "justification": "Amostra live requerida (50 tarefas) suspensa pendente de integração e piloto em clientes reais externos com prova documental.",
      "sample_status": "INSUFFICIENT",
      "cert_l3_decision": "CERT_L3_BLOCKED_PENDING_EXTERNAL_AUDIT",
      "restrictions": [
        "BLOCKED: Ausência de evidência física de execução em ambiente live externo de cliente",
        "CERT_L3_BLOCKED_PENDING_EXTERNAL_AUDIT"
      ]
    },
    {
      "employee_id": "003",
      "role": "AI Employee 003",
      "department": "Strategy",
      "risk_class": "LOW",
      "critical_workflows": [
        "Análise Documental",
        "Validação Supervisionada em Piloto Controlado"
      ],
      "workflow_count": 5,
      "financial_exposure": "LOW",
      "regulatory_exposure": "LOW",
      "data_sensitivity": "STANDARD",
      "irreversibility": "LOW",
      "autonomy_level": "HITL_REQUIRED",
      "baseline_required_live_tasks": 50,
      "adjustment_factor": 1,
      "final_required_live_tasks": 50,
      "credited_initial_live_tasks": 0,
      "expanded_live_tasks": 0,
      "total_actual_live_tasks": 0,
      "remaining_live_tasks": 50,
      "unique_business_case_ratio": 0,
      "justification": "Amostra live requerida (50 tarefas) suspensa pendente de integração e piloto em clientes reais externos com prova documental.",
      "sample_status": "INSUFFICIENT",
      "cert_l3_decision": "CERT_L3_BLOCKED_PENDING_EXTERNAL_AUDIT",
      "restrictions": [
        "BLOCKED: Ausência de evidência física de execução em ambiente live externo de cliente",
        "CERT_L3_BLOCKED_PENDING_EXTERNAL_AUDIT"
      ]
    },
    {
      "employee_id": "004",
      "role": "AI Employee 004",
      "department": "Strategy",
      "risk_class": "LOW",
      "critical_workflows": [
        "Análise Documental",
        "Validação Supervisionada em Piloto Controlado"
      ],
      "workflow_count": 5,
      "financial_exposure": "LOW",
      "regulatory_exposure": "LOW",
      "data_sensitivity": "STANDARD",
      "irreversibility": "LOW",
      "autonomy_level": "HITL_REQUIRED",
      "baseline_required_live_tasks": 50,
      "adjustment_factor": 1,
      "final_required_live_tasks": 50,
      "credited_initial_live_tasks": 0,
      "expanded_live_tasks": 0,
      "total_actual_live_tasks": 0,
      "remaining_live_tasks": 50,
      "unique_business_case_ratio": 0,
      "justification": "Amostra live requerida (50 tarefas) suspensa pendente de integração e piloto em clientes reais externos com prova documental.",
      "sample_status": "INSUFFICIENT",
      "cert_l3_decision": "CERT_L3_BLOCKED_PENDING_EXTERNAL_AUDIT",
      "restrictions": [
        "BLOCKED: Ausência de evidência física de execução em ambiente live externo de cliente",
        "CERT_L3_BLOCKED_PENDING_EXTERNAL_AUDIT"
      ]
    },
    {
      "employee_id": "005",
      "role": "AI Employee 005",
      "department": "Strategy",
      "risk_class": "LOW",
      "critical_workflows": [
        "Análise Documental",
        "Validação Supervisionada em Piloto Controlado"
      ],
      "workflow_count": 5,
      "financial_exposure": "LOW",
      "regulatory_exposure": "LOW",
      "data_sensitivity": "STANDARD",
      "irreversibility": "LOW",
      "autonomy_level": "HITL_REQUIRED",
      "baseline_required_live_tasks": 50,
      "adjustment_factor": 1,
      "final_required_live_tasks": 50,
      "credited_initial_live_tasks": 0,
      "expanded_live_tasks": 0,
      "total_actual_live_tasks": 0,
      "remaining_live_tasks": 50,
      "unique_business_case_ratio": 0,
      "justification": "Amostra live requerida (50 tarefas) suspensa pendente de integração e piloto em clientes reais externos com prova documental.",
      "sample_status": "INSUFFICIENT",
      "cert_l3_decision": "CERT_L3_BLOCKED_PENDING_EXTERNAL_AUDIT",
      "restrictions": [
        "BLOCKED: Ausência de evidência física de execução em ambiente live externo de cliente",
        "CERT_L3_BLOCKED_PENDING_EXTERNAL_AUDIT"
      ]
    },
    {
      "employee_id": "006",
      "role": "AI Employee 006",
      "department": "Strategy",
      "risk_class": "LOW",
      "critical_workflows": [
        "Análise Documental",
        "Validação Supervisionada em Piloto Controlado"
      ],
      "workflow_count": 5,
      "financial_exposure": "LOW",
      "regulatory_exposure": "LOW",
      "data_sensitivity": "STANDARD",
      "irreversibility": "LOW",
      "autonomy_level": "HITL_REQUIRED",
      "baseline_required_live_tasks": 50,
      "adjustment_factor": 1,
      "final_required_live_tasks": 50,
      "credited_initial_live_tasks": 0,
      "expanded_live_tasks": 0,
      "total_actual_live_tasks": 0,
      "remaining_live_tasks": 50,
      "unique_business_case_ratio": 0,
      "justification": "Amostra live requerida (50 tarefas) suspensa pendente de integração e piloto em clientes reais externos com prova documental.",
      "sample_status": "INSUFFICIENT",
      "cert_l3_decision": "CERT_L3_BLOCKED_PENDING_EXTERNAL_AUDIT",
      "restrictions": [
        "BLOCKED: Ausência de evidência física de execução em ambiente live externo de cliente",
        "CERT_L3_BLOCKED_PENDING_EXTERNAL_AUDIT"
      ]
    },
    {
      "employee_id": "007",
      "role": "AI Employee 007",
      "department": "Strategy",
      "risk_class": "LOW",
      "critical_workflows": [
        "Análise Documental",
        "Validação Supervisionada em Piloto Controlado"
      ],
      "workflow_count": 5,
      "financial_exposure": "LOW",
      "regulatory_exposure": "LOW",
      "data_sensitivity": "STANDARD",
      "irreversibility": "LOW",
      "autonomy_level": "HITL_REQUIRED",
      "baseline_required_live_tasks": 50,
      "adjustment_factor": 1,
      "final_required_live_tasks": 50,
      "credited_initial_live_tasks": 0,
      "expanded_live_tasks": 0,
      "total_actual_live_tasks": 0,
      "remaining_live_tasks": 50,
      "unique_business_case_ratio": 0,